{
  "slug": "growth4u",
  "collectedAt": "2026-03-16T17:16:09.026Z",
  "dateRange": {
    "from": "2026-03-15",
    "to": "2026-03-15"
  },
  "sources": {
    "meta-ads": {
      "status": "ok",
      "collectedAt": "2026-03-16T17:16:12.299Z",
      "metrics": [
        {
          "name": "spend",
          "value": 147.17,
          "date": "2026-03-15"
        },
        {
          "name": "impressions",
          "value": 6413,
          "date": "2026-03-15"
        },
        {
          "name": "clicks",
          "value": 165,
          "date": "2026-03-15"
        },
        {
          "name": "ctr",
          "value": 2.572899,
          "date": "2026-03-15"
        },
        {
          "name": "cpc",
          "value": 0.891939,
          "date": "2026-03-15"
        },
        {
          "name": "leads",
          "value": 3,
          "date": "2026-03-15"
        },
        {
          "name": "spend",
          "value": 147.17,
          "date": "2026-03-15",
          "dimensions": {
            "campaign": "G4U - Testeo Creativos - Copy"
          }
        },
        {
          "name": "impressions",
          "value": 6413,
          "date": "2026-03-15",
          "dimensions": {
            "campaign": "G4U - Testeo Creativos - Copy"
          }
        },
        {
          "name": "clicks",
          "value": 165,
          "date": "2026-03-15",
          "dimensions": {
            "campaign": "G4U - Testeo Creativos - Copy"
          }
        },
        {
          "name": "ctr",
          "value": 2.572899,
          "date": "2026-03-15",
          "dimensions": {
            "campaign": "G4U - Testeo Creativos - Copy"
          }
        },
        {
          "name": "cpc",
          "value": 0.891939,
          "date": "2026-03-15",
          "dimensions": {
            "campaign": "G4U - Testeo Creativos - Copy"
          }
        },
        {
          "name": "leads",
          "value": 3,
          "date": "2026-03-15",
          "dimensions": {
            "campaign": "G4U - Testeo Creativos - Copy"
          }
        },
        {
          "name": "spend",
          "value": 33.99,
          "date": "2026-03-15",
          "dimensions": {
            "adset": "unknown",
            "campaign": "G4U - Testeo Creativos - Copy"
          }
        },
        {
          "name": "impressions",
          "value": 2115,
          "date": "2026-03-15",
          "dimensions": {
            "adset": "unknown",
            "campaign": "G4U - Testeo Creativos - Copy"
          }
        },
        {
          "name": "clicks",
          "value": 44,
          "date": "2026-03-15",
          "dimensions": {
            "adset": "unknown",
            "campaign": "G4U - Testeo Creativos - Copy"
          }
        },
        {
          "name": "ctr",
          "value": 2.080378,
          "date": "2026-03-15",
          "dimensions": {
            "adset": "unknown",
            "campaign": "G4U - Testeo Creativos - Copy"
          }
        },
        {
          "name": "cpc",
          "value": 0.7725,
          "date": "2026-03-15",
          "dimensions": {
            "adset": "unknown",
            "campaign": "G4U - Testeo Creativos - Copy"
          }
        },
        {
          "name": "spend",
          "value": 37.16,
          "date": "2026-03-15",
          "dimensions": {
            "adset": "unknown",
            "campaign": "G4U - Testeo Creativos - Copy"
          }
        },
        {
          "name": "impressions",
          "value": 1499,
          "date": "2026-03-15",
          "dimensions": {
            "adset": "unknown",
            "campaign": "G4U - Testeo Creativos - Copy"
          }
        },
        {
          "name": "clicks",
          "value": 43,
          "date": "2026-03-15",
          "dimensions": {
            "adset": "unknown",
            "campaign": "G4U - Testeo Creativos - Copy"
          }
        },
        {
          "name": "ctr",
          "value": 2.868579,
          "date": "2026-03-15",
          "dimensions": {
            "adset": "unknown",
            "campaign": "G4U - Testeo Creativos - Copy"
          }
        },
        {
          "name": "cpc",
          "value": 0.864186,
          "date": "2026-03-15",
          "dimensions": {
            "adset": "unknown",
            "campaign": "G4U - Testeo Creativos - Copy"
          }
        },
        {
          "name": "spend",
          "value": 38.57,
          "date": "2026-03-15",
          "dimensions": {
            "adset": "unknown",
            "campaign": "G4U - Testeo Creativos - Copy"
          }
        },
        {
          "name": "impressions",
          "value": 1689,
          "date": "2026-03-15",
          "dimensions": {
            "adset": "unknown",
            "campaign": "G4U - Testeo Creativos - Copy"
          }
        },
        {
          "name": "clicks",
          "value": 44,
          "date": "2026-03-15",
          "dimensions": {
            "adset": "unknown",
            "campaign": "G4U - Testeo Creativos - Copy"
          }
        },
        {
          "name": "ctr",
          "value": 2.605092,
          "date": "2026-03-15",
          "dimensions": {
            "adset": "unknown",
            "campaign": "G4U - Testeo Creativos - Copy"
          }
        },
        {
          "name": "cpc",
          "value": 0.876591,
          "date": "2026-03-15",
          "dimensions": {
            "adset": "unknown",
            "campaign": "G4U - Testeo Creativos - Copy"
          }
        },
        {
          "name": "spend",
          "value": 37.45,
          "date": "2026-03-15",
          "dimensions": {
            "adset": "unknown",
            "campaign": "G4U - Testeo Creativos - Copy"
          }
        },
        {
          "name": "impressions",
          "value": 1110,
          "date": "2026-03-15",
          "dimensions": {
            "adset": "unknown",
            "campaign": "G4U - Testeo Creativos - Copy"
          }
        },
        {
          "name": "clicks",
          "value": 34,
          "date": "2026-03-15",
          "dimensions": {
            "adset": "unknown",
            "campaign": "G4U - Testeo Creativos - Copy"
          }
        },
        {
          "name": "ctr",
          "value": 3.063063,
          "date": "2026-03-15",
          "dimensions": {
            "adset": "unknown",
            "campaign": "G4U - Testeo Creativos - Copy"
          }
        },
        {
          "name": "cpc",
          "value": 1.101471,
          "date": "2026-03-15",
          "dimensions": {
            "adset": "unknown",
            "campaign": "G4U - Testeo Creativos - Copy"
          }
        },
        {
          "name": "spend",
          "value": 12.97,
          "date": "2026-03-15",
          "dimensions": {
            "ad": "Ángulo 2_V3",
            "adset": "Ángulo 2",
            "campaign": "G4U - Testeo Creativos - Copy"
          }
        },
        {
          "name": "impressions",
          "value": 324,
          "date": "2026-03-15",
          "dimensions": {
            "ad": "Ángulo 2_V3",
            "adset": "Ángulo 2",
            "campaign": "G4U - Testeo Creativos - Copy"
          }
        },
        {
          "name": "clicks",
          "value": 8,
          "date": "2026-03-15",
          "dimensions": {
            "ad": "Ángulo 2_V3",
            "adset": "Ángulo 2",
            "campaign": "G4U - Testeo Creativos - Copy"
          }
        },
        {
          "name": "ctr",
          "value": 2.469136,
          "date": "2026-03-15",
          "dimensions": {
            "ad": "Ángulo 2_V3",
            "adset": "Ángulo 2",
            "campaign": "G4U - Testeo Creativos - Copy"
          }
        },
        {
          "name": "cpc",
          "value": 1.62125,
          "date": "2026-03-15",
          "dimensions": {
            "ad": "Ángulo 2_V3",
            "adset": "Ángulo 2",
            "campaign": "G4U - Testeo Creativos - Copy"
          }
        },
        {
          "name": "linkClicks",
          "value": 6,
          "date": "2026-03-15",
          "dimensions": {
            "ad": "Ángulo 2_V3",
            "adset": "Ángulo 2",
            "campaign": "G4U - Testeo Creativos - Copy"
          }
        },
        {
          "name": "engagement",
          "value": 80,
          "date": "2026-03-15",
          "dimensions": {
            "ad": "Ángulo 2_V3",
            "adset": "Ángulo 2",
            "campaign": "G4U - Testeo Creativos - Copy"
          }
        },
        {
          "name": "spend",
          "value": 23.83,
          "date": "2026-03-15",
          "dimensions": {
            "ad": "Ángulo 3_V3",
            "adset": "Ángulo 3",
            "campaign": "G4U - Testeo Creativos - Copy"
          }
        },
        {
          "name": "impressions",
          "value": 1162,
          "date": "2026-03-15",
          "dimensions": {
            "ad": "Ángulo 3_V3",
            "adset": "Ángulo 3",
            "campaign": "G4U - Testeo Creativos - Copy"
          }
        },
        {
          "name": "clicks",
          "value": 26,
          "date": "2026-03-15",
          "dimensions": {
            "ad": "Ángulo 3_V3",
            "adset": "Ángulo 3",
            "campaign": "G4U - Testeo Creativos - Copy"
          }
        },
        {
          "name": "ctr",
          "value": 2.237522,
          "date": "2026-03-15",
          "dimensions": {
            "ad": "Ángulo 3_V3",
            "adset": "Ángulo 3",
            "campaign": "G4U - Testeo Creativos - Copy"
          }
        },
        {
          "name": "cpc",
          "value": 0.916538,
          "date": "2026-03-15",
          "dimensions": {
            "ad": "Ángulo 3_V3",
            "adset": "Ángulo 3",
            "campaign": "G4U - Testeo Creativos - Copy"
          }
        },
        {